{
  "schema_version": 1,
  "run_id": "example-default",
  "status": "success",
  "effective_config": {
    "schema_version": 1,
    "simulation": {
      "seed": 42,
      "shape": 100,
      "steps": 1000,
      "env": "patches",
      "env_param": 8,
      "backend": "cpu",
      "device": "cpu",
      "infra_decay": 0.0,
      "defense_coeff": 0.0,
      "radiate_interval": 50,
      "cleanup_interval": 100,
      "emergency_pop_cap": 1000,
      "checkpoint_interval": 100,
      "log_interval": 10
    },
    "evaluation": {
      "prompt": "branching colonies",
      "bin_width": 1.0
    },
    "output": {
      "root": "data/raw/pilot"
    }
  },
  "completed_steps": 1000,
  "artifacts": {
    "checkpoints": [
      {"completed_steps": 0, "directory": "checkpoint_0000000"},
      {"completed_steps": 100, "directory": "checkpoint_0000100"},
      {"completed_steps": 200, "directory": "checkpoint_0000200"},
      {"completed_steps": 300, "directory": "checkpoint_0000300"},
      {"completed_steps": 400, "directory": "checkpoint_0000400"},
      {"completed_steps": 500, "directory": "checkpoint_0000500"},
      {"completed_steps": 600, "directory": "checkpoint_0000600"},
      {"completed_steps": 700, "directory": "checkpoint_0000700"},
      {"completed_steps": 800, "directory": "checkpoint_0000800"},
      {"completed_steps": 900, "directory": "checkpoint_0000900"},
      {"completed_steps": 1000, "directory": "checkpoint_0001000"}
    ],
    "final_checkpoint": "checkpoint_0001000",
    "final_image": "images/final.png",
    "log": "step_log.csv",
    "metadata": "meta.json"
  },
  "provenance": {
    "git_commit": null,
    "git_dirty": null,
    "backend": "cpu",
    "device": "cpu",
    "versions": {}
  },
  "evaluation": {
    "clip": null,
    "entropy": null
  },
  "error": null
}
